{
  "databaseSourceAdapterRuntimeId": "databasesourceadapterruntime-001",
  "generatedAt": "2026-06-04T22:10:00Z",
  "runtimeStatus": "approved_database_source_adapter_runtime_checked",
  "runtimeScope": "bounded_caller_approved_database_adapter",
  "normalChecksOffline": true,
  "sourceBindingId": "sourcebinding-115002",
  "domainKey": "seaport-berth-availability",
  "runtimeCases": [
    {
      "caseName": "approved_fixture",
      "caseStatus": "adapter_output_ready",
      "runtimeRequest": {
        "sourceBindingId": "sourcebinding-115002",
        "sourceRole": "vessel_schedule",
        "approvedQueryManifestRef": "querymanifest-seaport-vessel-schedule-001",
        "credentialRef": "credentialref-seaport-readonly-001",
        "rowLimit": 250,
        "timeLimitSeconds": 15,
        "freshnessWindowHours": 12,
        "leakageWindow": {
          "forecastCloseTime": "2026-06-12T08:00:00Z",
          "resolutionEvidenceAfter": "2026-06-12T18:00:00Z"
        },
        "callerApprovalStatus": "approved"
      },
      "sanitizedAdapterOutput": {
        "sourceManifest": {
          "sourceManifestId": "sourcemanifest-1501",
          "domainSetupId": "domainsetup-002",
          "domain": "seaport-berth-availability",
          "sourceRole": "vessel_schedule",
          "sourceKind": "private_database",
          "rowCount": 42,
          "rawRowsIncluded": false
        },
        "fieldMapping": {
          "fieldMappingId": "fieldmapping-1501",
          "sourceManifestId": "sourcemanifest-1501",
          "mappingStatus": "confirmed",
          "mappedFieldCount": 8,
          "agentInferredFieldsRequireConfirmation": false
        },
        "provenanceSummary": {
          "adapterRunId": "databaseadapterrun-1501",
          "contentHashesStored": true,
          "credentialValuesIncluded": false,
          "rawRowsIncluded": false,
          "stackTraceIncluded": false,
          "diagnosticsSanitized": true
        },
        "sourceQualitySignals": {
          "freshnessStatus": "pass",
          "coverageStatus": "pass",
          "sourceQualityScore": 0.86,
          "minimumSourceQualityScore": 0.75
        },
        "mappingConfidenceSignals": {
          "mappingStatus": "confirmed",
          "mappingConfidence": 0.91,
          "minimumMappingConfidence": 0.8
        },
        "outcomeAvailabilityStatus": {
          "status": "available_resolution_only",
          "forecastTimeOutcomeEvidenceAllowed": false,
          "resolutionSourceBound": true
        },
        "queryBoundarySummary": {
          "queryManifestRef": "querymanifest-seaport-vessel-schedule-001",
          "readOnly": true,
          "rawSqlIncluded": false,
          "rawSqlWithSecretsIncluded": false,
          "unapprovedSchemaScan": false,
          "rowLimitApplied": true,
          "timeLimitApplied": true
        }
      },
      "sourceAdapterOutputCompatible": true,
      "canEnterSourceAdapterIntake": true,
      "databaseSpecificForecastPathCreated": false,
      "forecastArtifactsCreated": false,
      "rawPrivateRowsStored": false,
      "credentialValuesStored": false,
      "sanitizedDiagnosticsOnly": true,
      "nextAction": "run_source_adapter_intake"
    },
    {
      "caseName": "missing_approval",
      "caseStatus": "blocked_missing_approval",
      "runtimeRequest": {
        "sourceBindingId": "sourcebinding-115002",
        "sourceRole": "vessel_schedule",
        "approvedQueryManifestRef": "querymanifest-seaport-vessel-schedule-001",
        "credentialRef": "credentialref-seaport-readonly-001",
        "rowLimit": 250,
        "timeLimitSeconds": 15,
        "freshnessWindowHours": 12,
        "leakageWindow": {
          "forecastCloseTime": "2026-06-12T08:00:00Z",
          "resolutionEvidenceAfter": "2026-06-12T18:00:00Z"
        },
        "callerApprovalStatus": "not_requested"
      },
      "sanitizedAdapterOutput": {
        "sourceManifest": {
          "sourceManifestId": "none",
          "domainSetupId": "domainsetup-002",
          "domain": "seaport-berth-availability",
          "sourceRole": "vessel_schedule",
          "sourceKind": "private_database",
          "rowCount": 0,
          "rawRowsIncluded": false
        },
        "fieldMapping": {
          "fieldMappingId": "none",
          "sourceManifestId": "none",
          "mappingStatus": "not_created",
          "mappedFieldCount": 0,
          "agentInferredFieldsRequireConfirmation": false
        },
        "provenanceSummary": {
          "adapterRunId": "none",
          "contentHashesStored": false,
          "credentialValuesIncluded": false,
          "rawRowsIncluded": false,
          "stackTraceIncluded": false,
          "diagnosticsSanitized": true
        },
        "sourceQualitySignals": {
          "freshnessStatus": "not_evaluated",
          "coverageStatus": "not_evaluated",
          "sourceQualityScore": 0.0,
          "minimumSourceQualityScore": 0.75
        },
        "mappingConfidenceSignals": {
          "mappingStatus": "not_evaluated",
          "mappingConfidence": 0.0,
          "minimumMappingConfidence": 0.8
        },
        "outcomeAvailabilityStatus": {
          "status": "missing_approval",
          "forecastTimeOutcomeEvidenceAllowed": false,
          "resolutionSourceBound": false
        },
        "queryBoundarySummary": {
          "queryManifestRef": "blocked",
          "readOnly": true,
          "rawSqlIncluded": false,
          "rawSqlWithSecretsIncluded": false,
          "unapprovedSchemaScan": false,
          "rowLimitApplied": true,
          "timeLimitApplied": true
        }
      },
      "sourceAdapterOutputCompatible": false,
      "canEnterSourceAdapterIntake": false,
      "databaseSpecificForecastPathCreated": false,
      "forecastArtifactsCreated": false,
      "rawPrivateRowsStored": false,
      "credentialValuesStored": false,
      "sanitizedDiagnosticsOnly": true,
      "nextAction": "confirm_caller_approval"
    },
    {
      "caseName": "missing_credential_reference",
      "caseStatus": "blocked_missing_credential_reference",
      "runtimeRequest": {
        "sourceBindingId": "sourcebinding-115002",
        "sourceRole": "vessel_schedule",
        "approvedQueryManifestRef": "querymanifest-seaport-vessel-schedule-001",
        "credentialRef": "none",
        "rowLimit": 250,
        "timeLimitSeconds": 15,
        "freshnessWindowHours": 12,
        "leakageWindow": {
          "forecastCloseTime": "2026-06-12T08:00:00Z",
          "resolutionEvidenceAfter": "2026-06-12T18:00:00Z"
        },
        "callerApprovalStatus": "approved"
      },
      "sanitizedAdapterOutput": {
        "sourceManifest": {
          "sourceManifestId": "none",
          "domainSetupId": "domainsetup-002",
          "domain": "seaport-berth-availability",
          "sourceRole": "vessel_schedule",
          "sourceKind": "private_database",
          "rowCount": 0,
          "rawRowsIncluded": false
        },
        "fieldMapping": {
          "fieldMappingId": "none",
          "sourceManifestId": "none",
          "mappingStatus": "not_created",
          "mappedFieldCount": 0,
          "agentInferredFieldsRequireConfirmation": false
        },
        "provenanceSummary": {
          "adapterRunId": "none",
          "contentHashesStored": false,
          "credentialValuesIncluded": false,
          "rawRowsIncluded": false,
          "stackTraceIncluded": false,
          "diagnosticsSanitized": true
        },
        "sourceQualitySignals": {
          "freshnessStatus": "not_evaluated",
          "coverageStatus": "not_evaluated",
          "sourceQualityScore": 0.0,
          "minimumSourceQualityScore": 0.75
        },
        "mappingConfidenceSignals": {
          "mappingStatus": "not_evaluated",
          "mappingConfidence": 0.0,
          "minimumMappingConfidence": 0.8
        },
        "outcomeAvailabilityStatus": {
          "status": "missing_credential_reference",
          "forecastTimeOutcomeEvidenceAllowed": false,
          "resolutionSourceBound": false
        },
        "queryBoundarySummary": {
          "queryManifestRef": "blocked",
          "readOnly": true,
          "rawSqlIncluded": false,
          "rawSqlWithSecretsIncluded": false,
          "unapprovedSchemaScan": false,
          "rowLimitApplied": true,
          "timeLimitApplied": true
        }
      },
      "sourceAdapterOutputCompatible": false,
      "canEnterSourceAdapterIntake": false,
      "databaseSpecificForecastPathCreated": false,
      "forecastArtifactsCreated": false,
      "rawPrivateRowsStored": false,
      "credentialValuesStored": false,
      "sanitizedDiagnosticsOnly": true,
      "nextAction": "provide_credential_reference"
    },
    {
      "caseName": "unsafe_query_boundary",
      "caseStatus": "blocked_unsafe_query_boundary",
      "runtimeRequest": {
        "sourceBindingId": "sourcebinding-115002",
        "sourceRole": "vessel_schedule",
        "approvedQueryManifestRef": "unsafe-raw-sql-detected",
        "credentialRef": "credentialref-seaport-readonly-001",
        "rowLimit": 250,
        "timeLimitSeconds": 15,
        "freshnessWindowHours": 12,
        "leakageWindow": {
          "forecastCloseTime": "2026-06-12T08:00:00Z",
          "resolutionEvidenceAfter": "2026-06-12T18:00:00Z"
        },
        "callerApprovalStatus": "approved"
      },
      "sanitizedAdapterOutput": {
        "sourceManifest": {
          "sourceManifestId": "none",
          "domainSetupId": "domainsetup-002",
          "domain": "seaport-berth-availability",
          "sourceRole": "vessel_schedule",
          "sourceKind": "private_database",
          "rowCount": 0,
          "rawRowsIncluded": false
        },
        "fieldMapping": {
          "fieldMappingId": "none",
          "sourceManifestId": "none",
          "mappingStatus": "not_created",
          "mappedFieldCount": 0,